{
  "timezone": "UTC",
  "max_concurrent_valves": 1,
  "location": {"latitude": 0, "longitude": 0},
  "mqtt": {"enabled": false, "hostname": "broker.invalid", "client_name": "offlineFixture"},
  "telemetry": {"enabled": false, "idle_interval": 10, "active_interval": 1},
  "alerts": {
    "enabled": {
      "leak": true,
      "malfunction_no_flow": true,
      "irregular_flow": true,
      "sensor_error": true,
      "system_exit": true
    },
    "leak_repeat_minutes": 15,
    "irregular_flow_threshold": 2.0,
    "leak_detection_exclusions": [],
    "channels": []
  },
  "sensors": [],
  "valves": [
    {
      "name": "Offline fixture",
      "type": "3wire",
      "enabled": true,
      "watering_mode": "duration",
      "gpio_on_pin": 2,
      "gpio_off_pin": 3,
      "schedules": [
        {
          "time_based_on": "fixed",
          "fixed_start_time": "06:00",
          "duration": 10,
          "enable_uv_adjustments": false,
          "days": [],
          "seasons": []
        }
      ]
    }
  ]
}
